{"$schema":"https://json-schema.org/draft/2020-12/schema","type":"object","additionalProperties":false,"required":["schemaVersion","version","taskId","candidateId","candidateCommit","candidateTree","candidate","positioning","resolvedRuleSet","decision","auditReport","packageManifestSha256","runtimeManifestSha256","assuranceMatrixSha256","enableFormalClaims","owner","keyId","signedAt","signature"],"properties":{"schemaVersion":{"const":"3.2"},"version":{"type":"string"},"taskId":{"type":"string"},"candidateId":{"type":"string"},"candidateCommit":{"type":"string","pattern":"^[0-9a-f]{40}$"},"candidateTree":{"type":"string","pattern":"^[0-9a-f]{40}$"},"candidate":{"$ref":"#/$defs/ref"},"positioning":{"$ref":"#/$defs/ref"},"resolvedRuleSet":{"$ref":"#/$defs/ref"},"decision":{"$ref":"#/$defs/ref"},"auditReport":{"$ref":"#/$defs/ref"},"packageManifestSha256":{"type":"string","pattern":"^[0-9a-f]{64}$"},"runtimeManifestSha256":{"type":"string","pattern":"^[0-9a-f]{64}$"},"assuranceMatrixSha256":{"type":"string","pattern":"^[0-9a-f]{64}$"},"enableFormalClaims":{"const":true},"owner":{"type":"object"},"keyId":{"type":"string"},"signedAt":{"type":"string","format":"date-time"},"signature":{"type":"object"}},"$defs":{"ref":{"type":"object","additionalProperties":false,"required":["path","bytes","sha256","tracked"],"properties":{"path":{"type":"string"},"bytes":{"type":"integer","minimum":0},"sha256":{"type":"string","pattern":"^[0-9a-f]{64}$"},"tracked":{"const":true}}}}}
